text,intent
How can I apply for admission?,admission
What is the admission process?,admission
How do I enroll as a student?,admission
Can I apply online for admission?,admission
Where do I submit my application?,admission
What documents are required for admission?,admission
When can I apply for admission?,admission
Is there a deadline for application?,admission
How do I register as a new student?,admission
What steps are involved in admission?,admission

How do I apply to this university?,admission
Can you explain the admission process?,admission
Where can I apply for admission?,admission
How can I become a student here?,admission
What are the steps to enroll?,admission
Is online application available?,admission
How do I start my application?,admission
What do I need to apply?,admission
Can I submit my application online?,admission
When does admission open?,admission

I want to apply for admission,admission
I would like to enroll as a student,admission
I want to know how to apply,admission
Can you guide me on admission?,admission
Please tell me how to apply,admission
I need help with admission,admission
I want to register as a student,admission
How can I begin the admission process?,admission
What should I do to enroll?,admission
How do I join the university?,admission

How can I apply as a new student?,admission
What is needed for admission?,admission
Where do I send my application?,admission
How do I complete my application?,admission
Can I apply through the website?,admission
What is required to enroll?,admission
How do I sign up as a student?,admission
When is the admission period?,admission
Can you tell me the admission steps?,admission
What is the first step for admission?,admission

How do I apply for a course?,admission
Can I enroll in this university?,admission
How do I register for admission?,admission
What is the procedure for admission?,admission
How can I submit admission forms?,admission
Is there an online form for admission?,admission
Where can I find the admission form?,admission
What do I need for enrollment?,admission
How can I join as a new student?,admission
Can I apply now?,admission

How do I apply here?,admission
What are the requirements to apply?,admission
How can I enroll in a program?,admission
Where do I apply for courses?,admission
What documents do I need?,admission
Is there an admission portal?,admission
Can I apply through the portal?,admission
How do I access the application form?,admission
What is the enrollment process?,admission
When can I start applying?,admission

Can you help me with admission?,admission
I need information about admission,admission
How do I apply for studies?,admission
What is required for application?,admission
Where can I register?,admission
How can I get admitted?,admission
Is admission open now?,admission
How do I join this university?,admission
What is the process to join?,admission
How can I enroll here?,admission

Please explain how to apply,admission
Can you guide me through admission?,admission
What are the steps to apply?,admission
Where should I apply?,admission
How do I send my documents?,admission
Is admission available online?,admission
How do I enroll for classes?,admission
What do I need to register?,admission
How can I apply successfully?,admission
What is needed to join?,admission

How do I get into this university?,admission
Can I apply from home?,admission
Is online enrollment possible?,admission
Where do I start my application?,admission
How do I fill the application form?,admission
What is the admission requirement?,admission
Can I enroll today?,admission
When should I apply?,admission
How can I secure admission?,admission
What is the enrollment requirement?,admission

How do I apply for degree programs?,admission
Can I register online?,admission
Where is the application link?,admission
How do I apply step by step?,admission
What is needed for registration?,admission
How do I complete enrollment?,admission
Can I apply without visiting campus?,admission
What documents must I prepare?,admission
How can I submit my form?,admission
Is admission easy?,admission

How do I apply as an international student?,admission
Can I enroll as a full-time student?,admission
What is required to join courses?,admission
How do I register for classes?,admission
Can I apply this semester?,admission
When is the application closing date?,admission
How can I get accepted?,admission
What are admission criteria?,admission
How do I apply quickly?,admission
What is the easiest way to apply?,admission

How can I join this course?,admission
Where do I begin enrollment?,admission
How do I apply for studies here?,admission
What should I prepare for admission?,admission
Can I apply through email?,admission
How do I get admission approval?,admission
Where do I upload documents?,admission
How do I track my application?,admission
Can I apply anytime?,admission
How do I apply now?,admission

How can I enter this university?,admission
What is the process of applying?,admission
How do I get started with admission?,admission
Can you explain how to enroll?,admission
Where do I register for admission?,admission
What do I need before applying?,admission
How do I confirm my admission?,admission
Is there an online admission system?,admission
How do I complete the admission steps?,admission
What is the procedure to join?,admission

How can I apply successfully online?,admission
What is the enrollment procedure?,admission
How do I apply step by step online?,admission
Can I enroll without visiting?,admission
Where can I apply online?,admission
How do I complete application online?,admission
What is the full admission process?,admission
How do I get admission confirmation?,admission
Can I apply immediately?,admission
What are the requirements for applying?,admission

How do I begin my admission application?,admission
Where can I submit my admission form?,admission
Can you guide me through the enrollment process?,admission
How do I apply for admission online step by step?,admission
What should I do first to apply?,admission
How do I register for admission online?,admission
Where do I upload my admission documents?,admission
Can I apply for admission without visiting campus?,admission
How do I apply for the upcoming intake?,admission
What is the process for new student registration?,admission

How do I apply for university admission easily?,admission
Where can I get admission application details?,admission
What steps should I follow to apply?,admission
How do I enroll in a programme?,admission
Can I apply for admission this month?,admission
What do I need before applying for admission?,admission
How do I proceed with my application?,admission
Is there a guide for admission application?,admission
How do I complete the admission registration?,admission
Where can I check admission requirements?,admission

How much is the tuition fee?,fees
What are the tuition fees?,fees
How do I pay my fees?,fees
Can I pay my fees online?,fees
When is the payment deadline?,fees
Where can I pay my tuition fees?,fees
Is there a late payment penalty?,fees
Can I pay using bank transfer?,fees
How do I check my fee balance?,fees
Are installment payments available?,fees

What is the cost of tuition?,fees
How much do I need to pay?,fees
Can I pay fees through online banking?,fees
Where do I make fee payment?,fees
What happens if I pay late?,fees
Is there a penalty for late payment?,fees
How can I view my outstanding fees?,fees
Can I pay fees in installments?,fees
Is there a fee payment portal?,fees
How do I access the payment system?,fees

I want to check my fees,fees
I need to know my tuition fees,fees
Please tell me the fee amount,fees
I want to pay my fees,fees
Can you help me with fee payment?,fees
I need help with tuition fees,fees
How can I settle my fees?,fees
I want to know the payment deadline,fees
How do I manage my fee payment?,fees
I want to check my fee balance,fees

How much are the course fees?,fees
What is the total fee amount?,fees
How do I pay my tuition online?,fees
Can I pay fees using credit card?,fees
When should I pay my fees?,fees
Where do I check payment details?,fees
Is there any discount on fees?,fees
How do I pay my fees step by step?,fees
What payment methods are accepted?,fees
How can I avoid late fees?,fees

Can I pay fees monthly?,fees
How do I check payment status?,fees
Where can I see my fee statement?,fees
What are the payment options?,fees
Is online payment available?,fees
Can I use e-wallet to pay fees?,fees
How do I pay using bank transfer?,fees
Is there any additional charge?,fees
How do I confirm my payment?,fees
Can I pay through mobile banking?,fees

How much do I owe?,fees
Where do I pay my tuition?,fees
What is the deadline for payment?,fees
Can I pay fees at the office?,fees
How do I check if my fees are paid?,fees
Is there a fee payment schedule?,fees
How can I pay my outstanding fees?,fees
What is the due date for fees?,fees
Can I delay my fee payment?,fees
How do I request installment?,fees

Please tell me how to pay fees,fees
Can you guide me on fee payment?,fees
What is the easiest way to pay fees?,fees
Where can I find payment instructions?,fees
How do I pay fees online?,fees
Is there a portal for fee payment?,fees
How can I make payment quickly?,fees
What do I need to pay fees?,fees
How do I pay fees without errors?,fees
Can I pay fees anytime?,fees

How do I pay tuition fees?,fees
What is the payment process?,fees
Where can I get payment details?,fees
Can I pay fees in cash?,fees
Is there a payment counter?,fees
How do I know my fee amount?,fees
Can I pay fees using ATM?,fees
What are the accepted payment methods?,fees
How do I track my payment?,fees
Can I get a payment receipt?,fees

How do I check if my payment is successful?,fees
What happens after I pay fees?,fees
Can I download my receipt?,fees
Where do I confirm payment?,fees
How do I verify my payment?,fees
Is there confirmation after payment?,fees
How do I ensure my payment is recorded?,fees
Can I see my payment history?,fees
How do I access my fee records?,fees
What should I do after payment?,fees

How much should I pay this semester?,fees
What is my current fee balance?,fees
Can I check my fees online?,fees
Where can I view my tuition balance?,fees
How do I calculate my fees?,fees
Is there a breakdown of fees?,fees
What is included in tuition fees?,fees
Are there extra charges?,fees
How do I check additional fees?,fees
Can I get a fee summary?,fees

How do I pay my fees securely?,fees
Is online payment safe?,fees
Can I use online banking to pay?,fees
What is the safest way to pay fees?,fees
Can I pay fees through apps?,fees
How do I use the payment system?,fees
Where can I log in to pay fees?,fees
Can I pay fees using my phone?,fees
How do I complete payment online?,fees
Is payment available 24/7?,fees

Can I pay fees in advance?,fees
What if I miss the payment deadline?,fees
Can I request fee extension?,fees
How do I avoid penalty charges?,fees
Is there a grace period for payment?,fees
What happens if I don't pay on time?,fees
Can I negotiate payment terms?,fees
How do I request payment extension?,fees
Is there a late fee charge?,fees
How do I settle overdue fees?,fees

How do I pay fees as a new student?,fees
Can new students pay fees online?,fees
What is the payment method for new students?,fees
How do I complete first payment?,fees
Where do new students pay fees?,fees
Can I pay fees before enrollment?,fees
What is the first payment step?,fees
How do I handle initial fees?,fees
Is there a guide for fee payment?,fees
How do I pay fees after admission?,fees

How do international students pay fees?,fees
Can I pay fees from overseas?,fees
What payment options are available for international students?,fees
Can I use international bank transfer?,fees
How do I pay fees from another country?,fees
Is online payment available globally?,fees
Can I use foreign currency to pay?,fees
How do I convert currency for payment?,fees
Is there extra charge for international payment?,fees
How do international students check fees?,fees

How do I view my fee details?,fees
Can I check my tuition fees online?,fees
Where can I see my payment history?,fees
How do I know how much to pay?,fees
What is my total tuition cost?,fees
Can I pay fees using online transfer?,fees
Where can I get my fee receipt?,fees
How do I make a payment online?,fees
Is there a system to check my fees?,fees
How do I confirm my tuition payment?,fees

What happens after I complete payment?,fees
Can I pay fees using my bank account?,fees
How do I find my fee breakdown?,fees
Where can I check my remaining balance?,fees
How do I know if I paid successfully?,fees
Is there a way to track my payments?,fees
How do I check fee status online?,fees
Can I pay fees before the deadline?,fees
How do I manage my tuition payments?,fees
What are my payment options available?,fees

What courses are offered?,courses
What programmes do you have?,courses
Do you offer computer science?,courses
What can I study here?,courses
What degree programmes are available?,courses
Do you have business courses?,courses
What diploma courses are available?,courses
What subjects can I enroll in?,courses
Are there IT programmes available?,courses
What courses can I take?,courses

What are the available programmes?,courses
Can you list the courses offered?,courses
Do you provide engineering courses?,courses
What fields of study are available?,courses
Are there any diploma programmes?,courses
Do you offer degree courses?,courses
What courses are available this semester?,courses
Can I study computer science here?,courses
Do you offer business programmes?,courses
What academic programmes are available?,courses

I want to know about courses,courses
I need information about programmes,courses
Please tell me what courses are available,courses
Can you explain the available courses?,courses
I am interested in your programmes,courses
What options do I have for study?,courses
I want to choose a course,courses
Can you guide me on courses?,courses
I need help choosing a programme,courses
What courses can I enroll in?,courses

Do you have IT courses?,courses
Are there any business degrees?,courses
What science courses do you offer?,courses
Do you offer diploma in IT?,courses
Can I take engineering here?,courses
What are the popular courses?,courses
What programmes are offered here?,courses
Do you provide undergraduate courses?,courses
Are postgraduate courses available?,courses
Can I study business management?,courses

How many courses are available?,courses
What programmes can I apply for?,courses
Do you offer part-time courses?,courses
Are there full-time programmes?,courses
What courses are suitable for beginners?,courses
Do you offer advanced programmes?,courses
Can I choose multiple courses?,courses
What courses are open for admission?,courses
Are online courses available?,courses
Do you have short courses?,courses

Please list all courses,courses
Can you show me the available programmes?,courses
What are the course options?,courses
Which programmes can I study?,courses
What degrees are available?,courses
Do you offer foundation courses?,courses
Are there certificate courses?,courses
What are the course categories?,courses
Can I see the course list?,courses
What programmes can I choose?,courses

What courses are offered this year?,courses
Do you provide IT-related courses?,courses
Are business programmes available?,courses
Can I study accounting?,courses
What technology courses do you offer?,courses
Are there management courses?,courses
What are the study options?,courses
Do you have science programmes?,courses
What subjects are included in courses?,courses
Can I take computing courses?,courses

How do I choose a course?,courses
Can you recommend a programme?,courses
What course should I take?,courses
Which course is best for me?,courses
How do I select a programme?,courses
Can I change my course later?,courses
What courses are flexible?,courses
Are there beginner courses?,courses
Do you offer specialized programmes?,courses
What courses fit my interests?,courses

Do you offer diploma in business?,courses
Can I study information technology?,courses
Are there courses in engineering?,courses
Do you have courses in finance?,courses
What are the available majors?,courses
Can I study marketing?,courses
Do you offer data science courses?,courses
Are there courses in software development?,courses
What IT subjects are available?,courses
Can I study artificial intelligence?,courses

What are the programme requirements?,courses
Are there prerequisites for courses?,courses
What qualifications are needed for courses?,courses
How do I enroll in a course?,courses
What courses require prior knowledge?,courses
Are there beginner-friendly programmes?,courses
Do you offer skill-based courses?,courses
Can I take courses without experience?,courses
What courses are easy to start?,courses
What courses are advanced level?,courses

What courses are available for new students?,courses
Can I take multiple programmes?,courses
Do you offer flexible study options?,courses
Are weekend courses available?,courses
What courses are available online?,courses
Can I study remotely?,courses
What programmes are suitable for working students?,courses
Do you offer evening classes?,courses
Are there fast-track courses?,courses
What courses can I finish quickly?,courses

What courses are available internationally?,courses
Can international students choose any course?,courses
Are courses open to all students?,courses
What programmes are popular among students?,courses
Which courses are in high demand?,courses
What courses have good career prospects?,courses
Can you suggest popular courses?,courses
Which courses are recommended?,courses
What are trending programmes?,courses
What courses are best for future jobs?,courses

How can I get course details?,courses
Where can I find programme information?,courses
How do I learn more about courses?,courses
Is there a course catalog?,courses
Where can I view course descriptions?,courses
Can I download course information?,courses
How do I access course details?,courses
Where is the course list available?,courses
Can I get full programme details?,courses
What information is available about courses?,courses

Can I switch courses after enrolling?,courses
How do I change my programme?,courses
Is it easy to transfer courses?,courses
Can I upgrade my course?,courses
What happens if I change programmes?,courses
Are course transfers allowed?,courses
How do I move to another course?,courses
Can I choose a different programme later?,courses
What is the process to change courses?,courses
Can I modify my course selection?,courses

What courses can I choose from?,courses
Can you show me available degree programmes?,courses
What subjects are included in your programmes?,courses
Do you offer courses in technology?,courses
What programmes are open for enrollment?,courses
Can I get a list of all available courses?,courses
What are the study options available?,courses
Do you provide courses for beginners?,courses
What programmes can I join this semester?,courses
Are there courses related to IT?,courses

Can you recommend popular programmes?,courses
What courses are suitable for my interest?,courses
Do you offer short-term courses?,courses
What programmes are currently available?,courses
Can I see the full list of programmes?,courses
What courses are trending now?,courses
Do you offer flexible course options?,courses
What subjects are available this year?,courses
Can I choose electives in my course?,courses
What courses can help my career?,courses

How can I check my timetable?,timetable
Where can I view my class schedule?,timetable
How do I see my timetable online?,timetable
When are my classes?,timetable
Where is my timetable?,timetable
How do I check my class timing?,timetable
Can I view my schedule online?,timetable
Where can I find my timetable?,timetable
How do I access my class schedule?,timetable
What time is my next class?,timetable

How can I see my schedule?,timetable
Where do I check my classes?,timetable
How do I know my class times?,timetable
Can I check my timetable on the portal?,timetable
Where is the class timetable page?,timetable
How do I open my timetable?,timetable
Can I see today's classes?,timetable
How do I view my schedule?,timetable
Where can I check my lectures?,timetable
What is my class schedule?,timetable

I want to check my timetable,timetable
I need to see my class schedule,timetable
Please show me my timetable,timetable
Can you help me find my schedule?,timetable
I want to know my class timing,timetable
I need information about my timetable,timetable
Show my timetable,timetable
I want to see today's classes,timetable
How do I get my timetable?,timetable
I want to check my class times,timetable

Where can I find today's schedule?,timetable
How do I know when my classes are?,timetable
What time do my classes start?,timetable
Can I download my timetable?,timetable
Where can I print my schedule?,timetable
How do I get a copy of my timetable?,timetable
Is my timetable available online?,timetable
How do I check lecture times?,timetable
What is my daily schedule?,timetable
Where do I find my weekly timetable?,timetable

How do I check my timetable for this week?,timetable
Can I view my timetable on my phone?,timetable
Is there an app for timetable?,timetable
How do I access timetable from the portal?,timetable
Where is my class schedule located?,timetable
Can I check my timetable anytime?,timetable
What classes do I have today?,timetable
What is my schedule for today?,timetable
How do I see upcoming classes?,timetable
Where can I view my class plan?,timetable

How do I check my lecture schedule?,timetable
Where can I see my class timetable?,timetable
Can I check my timetable online anytime?,timetable
How do I check my subjects schedule?,timetable
Where do I see my subject timetable?,timetable
What is my lecture timetable?,timetable
How do I access my weekly schedule?,timetable
Can I see my class details?,timetable
Where do I find my class times?,timetable
How do I know when lectures are?,timetable

How can I check tomorrow's classes?,timetable
What is my class schedule for tomorrow?,timetable
How do I know my next lecture?,timetable
Where do I see my upcoming schedule?,timetable
Can I check timetable for next week?,timetable
How do I view future classes?,timetable
What classes do I have next?,timetable
Where can I find my next class time?,timetable
How do I check upcoming lectures?,timetable
What is my next subject?,timetable

Can I access timetable from student portal?,timetable
Where is the timetable section?,timetable
How do I navigate to timetable page?,timetable
Where do I log in to see my schedule?,timetable
How do I open timetable in portal?,timetable
Is timetable available in student system?,timetable
Where can I view my enrolled classes?,timetable
How do I check my subjects timetable?,timetable
Where is the class schedule option?,timetable
Can I access timetable easily?,timetable

How do I check if my timetable has changed?,timetable
Can timetable be updated?,timetable
How do I know if class time changes?,timetable
Where can I see updated timetable?,timetable
How do I track timetable changes?,timetable
Is there notification for timetable changes?,timetable
How do I confirm my class schedule?,timetable
Where can I see latest timetable?,timetable
Can I refresh my timetable?,timetable
How do I check schedule updates?,timetable

Can I download my class timetable?,timetable
Where can I export my timetable?,timetable
How do I save my timetable?,timetable
Can I print my class schedule?,timetable
How do I get a PDF of my timetable?,timetable
Where do I download my schedule?,timetable
Can I share my timetable?,timetable
How do I keep a copy of my timetable?,timetable
Is timetable downloadable?,timetable
How do I print my timetable?,timetable

How do I check timetable for each subject?,timetable
Where do I find subject schedules?,timetable
What time is my math class?,timetable
When is my programming class?,timetable
Where can I see subject timings?,timetable
How do I know subject schedule?,timetable
What is the timing for my course?,timetable
Can I view schedule by subject?,timetable
How do I check class by course?,timetable
Where do I find course timetable?,timetable

How do I check timetable as a new student?,timetable
Can new students view timetable?,timetable
Where do I find my first timetable?,timetable
How do I get my initial schedule?,timetable
When will I receive my timetable?,timetable
How do I check timetable after enrollment?,timetable
Can I see timetable before classes start?,timetable
Where do new students check schedule?,timetable
How do I access timetable for first semester?,timetable
What is my starting schedule?,timetable

How do I check timetable on mobile?,timetable
Can I access timetable from phone?,timetable
Is timetable available on app?,timetable
How do I view timetable on tablet?,timetable
Can I check timetable remotely?,timetable
How do I see timetable without computer?,timetable
Is there mobile access for timetable?,timetable
How do I check schedule on phone?,timetable
Where can I view timetable on mobile?,timetable
Can I log in to check timetable anywhere?,timetable

How can I view my timetable for today?,timetable
Where can I check my class schedule today?,timetable
How do I find my timetable for this semester?,timetable
Can I check my timetable through the student portal?,timetable
Where can I see my weekly class schedule?,timetable
How do I know my lecture timetable?,timetable
Can I access my timetable from the website?,timetable
Where do I check my subject timings?,timetable
How can I find out my class schedule?,timetable
Can I see my timetable for upcoming classes?,timetable

Where can I check my timetable details?,timetable
How do I view my course schedule?,timetable
Can I check my timetable anytime online?,timetable
