text,intent
Where can I see my enrolled class schedule?,timetable
How do I know what classes I have?,timetable
Can I view my timetable for all subjects?,timetable
Where do I access my class timetable online?,timetable
How can I check my daily class schedule?,timetable
Can I find my timetable on the system?,timetable
Where do I check my lecture schedule online?,timetable

How do I see my timetable for this month?,timetable
Can I check my class timings online?,timetable
Where can I view my timetable information?,timetable
How do I access my full timetable?,timetable
Can I check my class plan for the week?,timetable
Where can I see my timetable updates?,timetable
How do I check my upcoming timetable?,timetable
Where can I see my class schedule?,timetable
Where can I check my class schedule?,timetable
Where do I view my class schedule?,timetable

How can I contact the university?,contact
What is the university phone number?,contact
How do I reach the admin office?,contact
What is the contact email?,contact
Where can I find contact details?,contact
How do I get in touch with the university?,contact
What is the office contact number?,contact
How can I call the university?,contact
Where can I contact student services?,contact
What is the hotline number?,contact

How do I contact the registrar?,contact
What is the email for enquiries?,contact
Who should I contact for help?,contact
Where can I ask questions?,contact
How do I reach support staff?,contact
Can I contact the university by phone?,contact
What is the admin office email?,contact
How do I get support?,contact
Where can I send enquiries?,contact
What is the contact information?,contact

I want to contact the university,contact
I need to talk to someone,contact
Please give me contact details,contact
I need help from the office,contact
Can you give me contact info?,contact
I want to reach student services,contact
I need to contact admin,contact
How can I reach the office?,contact
I want to ask a question,contact
Who can I contact?,contact

Where is the university office?,contact
What is the office location?,contact
Where can I visit the admin office?,contact
How do I find the office?,contact
What is the address of the university?,contact
Can I visit the office?,contact
Where is student services located?,contact
How do I go to the office?,contact
Where is the admin department?,contact
What is the office address?,contact

How do I contact the university by email?,contact
What email should I use?,contact
Where can I send an email?,contact
What is the official email address?,contact
How do I email the university?,contact
Is there a support email?,contact
Can I contact via email?,contact
Where do I send my questions?,contact
What is the admin email?,contact
How do I write to the university?,contact

Can I call the university?,contact
What is the phone number to call?,contact
How do I contact by phone?,contact
Is there a contact number?,contact
What number should I dial?,contact
Can I speak to someone by phone?,contact
How do I reach by telephone?,contact
Where can I get the phone number?,contact
What is the office contact line?,contact
Can I contact the university directly?,contact

Who should I contact for admission?,contact
Who handles student enquiries?,contact
Which department should I contact?,contact
Who can help me with my issue?,contact
Where do I ask for help?,contact
Who do I talk to about courses?,contact
Who is responsible for student support?,contact
Which office handles enquiries?,contact
Who should I email for support?,contact
Who can assist me?,contact

How do I contact student services?,contact
Where is student support?,contact
Can I reach student services?,contact
How do I get help from support?,contact
What is student services contact?,contact
How do I talk to student support?,contact
Where can I find support contact?,contact
How do I contact help desk?,contact
Can I reach the help desk?,contact
Where is the support office?,contact

What is the best way to contact the university?,contact
How can I contact quickly?,contact
What is the fastest way to contact?,contact
Can I contact online?,contact
How do I contact through website?,contact
Is there a contact form?,contact
Where is the contact page?,contact
How do I submit an enquiry?,contact
Can I contact through portal?,contact
How do I reach out online?,contact

How do I contact for general enquiries?,contact
Where can I send general questions?,contact
What is general enquiry contact?,contact
How do I contact for information?,contact
Where can I get more information?,contact
Can I ask general questions?,contact
Who handles general enquiries?,contact
How do I contact information desk?,contact
Where is enquiry office?,contact
Can I contact for help?,contact

Can I contact international office?,contact
How do international students contact?,contact
What is contact for international students?,contact
Where do international students ask?,contact
Can I contact from overseas?,contact
How do I reach from another country?,contact
Is there international contact number?,contact
Can I email from abroad?,contact
Where can I contact international support?,contact
How do I reach global office?,contact

How do I contact admissions office?,contact
What is admission contact?,contact
Where do I contact for admission?,contact
Can I call admission office?,contact
What is admission phone number?,contact
How do I email admission office?,contact
Who handles admission enquiries?,contact
Where do I ask about admission?,contact
Can I contact admission team?,contact
How do I reach admission department?,contact

How do I contact finance office?,contact
What is finance contact?,contact
Where do I ask about fees?,contact
Can I call finance office?,contact
What is finance phone number?,contact
How do I email finance department?,contact
Who handles fee enquiries?,contact
Where do I contact for payment issues?,contact
Can I contact billing office?,contact
How do I reach finance department?,contact

How do I contact timetable office?,contact
Who handles class schedule enquiries?,contact
Where do I ask about timetable?,contact
Can I call timetable office?,contact
How do I email schedule office?,contact
Who manages class schedules?,contact
Where do I contact for timetable issues?,contact
Can I contact timetable department?,contact
What is timetable office contact?,contact
How do I reach timetable support?,contact

Can I contact via WhatsApp?,contact
Is there a live chat support?,contact
How do I contact through chat?,contact
Is online chat available?,contact
Can I message the university?,contact
How do I contact through social media?,contact
Is there a support chat?,contact
Where is live chat option?,contact
Can I contact through app?,contact
How do I message support?,contact

How do I contact during office hours?,contact
What are the office contact hours?,contact
When can I call the office?,contact
Is the office open now?,contact
What time can I contact?,contact
Can I contact after working hours?,contact
When is support available?,contact
What time is contact available?,contact
When can I reach staff?,contact
Is there weekend support?,contact

Hi,greeting
Hello,greeting
Hey,greeting
Hi there,greeting
Hello there,greeting
Hey there,greeting
Good morning,greeting
Good afternoon,greeting
Good evening,greeting
Hi chatbot,greeting

Hello bot,greeting
Hey chatbot,greeting
Hi assistant,greeting
Hello assistant,greeting
Hey assistant,greeting
Good day,greeting
Greetings,greeting
Hi everyone,greeting
Hello everyone,greeting
Hey everyone,greeting

"Hi, how are you?",greeting
"Hello, how are you?",greeting
"Hey, how are you?",greeting
"Hi, how is it going?",greeting
"Hello, how is everything?",greeting
"Hey, how are things?",greeting
"Hi, nice to meet you",greeting
"Hello, nice to meet you",greeting
"Hey, nice to meet you",greeting
Good to see you,greeting

"Hi, I need help",greeting
"Hello, I need some help",greeting
"Hey, can you help me?",greeting
"Hi, can I ask something?",greeting
"Hello, I have a question",greeting
"Hey, I need assistance",greeting
"Hi, I want to ask something",greeting
"Hello, can you assist me?",greeting
"Hey, I have a question",greeting
"Hi, can you help me?",greeting

"Good morning, I need help",greeting
"Good afternoon, I have a question",greeting
"Good evening, can you assist me?",greeting
"Hi, I need some information",greeting
"Hello, I need information",greeting
"Hey, I would like some help",greeting
"Hi, I need assistance",greeting
"Hello, I want to ask something",greeting
"Hey, I want some information",greeting
"Hi, I need guidance",greeting

Hi again,greeting
Hello again,greeting
Hey again,greeting
Hi there again,greeting
Hello there again,greeting
Hey there again,greeting
Good morning again,greeting
Good afternoon again,greeting
Good evening again,greeting
Hi chatbot again,greeting

"Hi, are you there?",greeting
"Hello, are you available?",greeting
"Hey, are you online?",greeting
"Hi, can you respond?",greeting
"Hello, are you ready?",greeting
"Hey, are you free?",greeting
"Hi, can we chat?",greeting
"Hello, can we talk?",greeting
"Hey, can I chat with you?",greeting
"Hi, are you active?",greeting

"Hi, what's up?",greeting
"Hello, what's going on?",greeting
"Hey, what's new?",greeting
"Hi, how's your day?",greeting
"Hello, how's your day going?",greeting
"Hey, how is your day?",greeting
"Hi, everything good?",greeting
"Hello, everything okay?",greeting
"Hey, all good?",greeting
"Hi, hope you're doing well",greeting

"Hello, hope you're doing well",greeting
"Hey, hope you're doing well",greeting
"Hi, nice to see you",greeting
"Hello, nice to see you",greeting
"Hey, nice to see you",greeting
"Hi, glad to see you",greeting
"Hello, glad to see you",greeting
"Hey, glad to see you",greeting
"Hi, good to see you",greeting
"Hello, good to see you",greeting

"Hi, I'm here",greeting
"Hello, I'm here",greeting
"Hey, I'm here",greeting
"Hi, I just logged in",greeting
"Hello, I just joined",greeting
"Hey, I just joined",greeting
"Hi, I just came in",greeting
"Hello, I just entered",greeting
"Hey, I just arrived",greeting
"Hi, I am back",greeting

"Hello, I am back",greeting
"Hey, I am back",greeting
"Hi, long time no see",greeting
"Hello, long time no see",greeting
"Hey, long time no see",greeting
"Hi, it's me again",greeting
"Hello, it's me again",greeting
"Hey, it's me again",greeting
"Hi, I am here again",greeting
"Hello, I am here again",greeting

Hey there chatbot,greeting
"Hello chatbot, how are you?",greeting
"Hi bot, how are you?",greeting
Hey bot,greeting
Hello system,greeting
Hi system,greeting
Hey system,greeting
Hello AI,greeting
Hi AI,greeting
Hey AI,greeting

"Hi, good morning to you",greeting
"Hello, good afternoon to you",greeting
"Hey, good evening to you",greeting
"Hi, wishing you a good day",greeting
"Hello, wishing you a nice day",greeting
"Hey, wishing you a great day",greeting
"Hi, have a good day",greeting
"Hello, have a nice day",greeting
"Hey, have a great day",greeting
"Hi, greetings",greeting

"Hello, greetings",greeting
"Hey, greetings",greeting
"Hi, warm greetings",greeting
"Hello, warm greetings",greeting
"Hey, warm greetings",greeting
"Hi, friendly greetings",greeting
"Hello, friendly greetings",greeting
"Hey, friendly greetings",greeting
"Hi, polite greetings",greeting
"Hello, polite greetings",greeting

"Hi there, how can you help me?",greeting
"Hello, I would like some help",greeting
"Hey, I need some assistance",greeting
"Hi, can you guide me?",greeting
"Hello, I have something to ask",greeting
"Hey, can I get some information?",greeting
"Hi, I need your help",greeting
"Hello, can you help me with something?",greeting
"Hey, I have a question for you",greeting
"Hi, can I talk to you?",greeting

"Hello, I just need some help",greeting
"Hey, I would like to ask something",greeting
"Hi, I have a quick question",greeting
"Hello, I need assistance",greeting
"Hey, can you assist me today?",greeting
"Hi, I am looking for help",greeting
"Hello, I would like some information",greeting
"Hey, I need guidance",greeting
"Hi, can you answer my question?",greeting
"Hello, can you support me?",greeting

Thank you,thanks
Thanks,thanks
Thanks a lot,thanks
Thank you very much,thanks
Thanks so much,thanks
I appreciate it,thanks
Much appreciated,thanks
Thank you for your help,thanks
Thanks for the information,thanks
That helps a lot,thanks

Thanks for your assistance,thanks
Thank you for assisting me,thanks
I really appreciate your help,thanks
Thanks for the support,thanks
Thank you for the support,thanks
Thanks for helping me,thanks
I appreciate your assistance,thanks
Thank you so much for your help,thanks
Thanks for your guidance,thanks
Thank you for the guidance,thanks

Thanks for the quick response,thanks
Thank you for replying quickly,thanks
Thanks for the fast reply,thanks
I appreciate the quick response,thanks
Thanks for getting back to me,thanks
Thank you for getting back to me,thanks
Thanks for responding,thanks
Thank you for responding,thanks
I appreciate your response,thanks
Thanks for the reply,thanks

"Thanks, that was helpful",thanks
"Thank you, that was helpful",thanks
"That was really helpful, thanks",thanks
"Thanks, that answers my question",thanks
"Thank you, that answers my question",thanks
"Thanks, I understand now",thanks
"Thank you, I understand now",thanks
"Thanks, that makes sense",thanks
"Thank you, that makes sense",thanks
"Thanks, I got it",thanks

Thanks a bunch,thanks
Thank you kindly,thanks
Many thanks,thanks
Thanks a million,thanks
Thanks heaps,thanks
Thank you very kindly,thanks
Thanks so much for your help,thanks
Thank you very much for your assistance,thanks
I am very grateful,thanks
I truly appreciate it,thanks

Thanks for the detailed explanation,thanks
Thank you for the detailed explanation,thanks
Thanks for explaining,thanks
Thank you for explaining,thanks
Thanks for clarifying,thanks
Thank you for clarifying,thanks
Thanks for the clear answer,thanks
Thank you for the clear answer,thanks
Thanks for making it clear,thanks
Thank you for making it clear,thanks

"Thanks, that was useful",thanks
"Thank you, that was useful",thanks
"Thanks, that was informative",thanks
"Thank you, that was informative",thanks
"Thanks, I learned something new",thanks
"Thank you, I learned something new",thanks
"Thanks, this is helpful",thanks
"Thank you, this is helpful",thanks
"Thanks, that helps a lot",thanks
"Thank you, that helps a lot",thanks

Thanks for your time,thanks
Thank you for your time,thanks
Thanks for taking the time to help,thanks
Thank you for taking the time,thanks
Thanks for your effort,thanks
Thank you for your effort,thanks
Thanks for your support today,thanks
Thank you for your support today,thanks
Thanks for assisting me today,thanks
Thank you for assisting me today,thanks

"Thanks, I appreciate it",thanks
"Thank you, I appreciate it",thanks
"Thanks, really appreciate it",thanks
"Thank you, really appreciate it",thanks
"Thanks, much appreciated",thanks
"Thank you, much appreciated",thanks
"Thanks, appreciate your help",thanks
"Thank you, appreciate your help",thanks
"Thanks, appreciate your support",thanks
"Thank you, appreciate your support",thanks

Thanks for the information provided,thanks
Thank you for the information provided,thanks
Thanks for sharing the information,thanks
Thank you for sharing the information,thanks
Thanks for giving me details,thanks
Thank you for giving me details,thanks
Thanks for the explanation,thanks
Thank you for the explanation,thanks
Thanks for the answer,thanks
Thank you for the answer,thanks

Thanks chatbot,thanks
Thank you chatbot,thanks
Thanks bot,thanks
Thank you bot,thanks
Thanks assistant,thanks
Thank you assistant,thanks
Thanks AI,thanks
Thank you AI,thanks
Thanks system,thanks
Thank you system,thanks

"Thanks, that was quick",thanks
"Thank you, that was quick",thanks
Thanks for the quick help,thanks
Thank you for the quick help,thanks
Thanks for solving my issue,thanks
Thank you for solving my issue,thanks
Thanks for your help today,thanks
Thank you for your help today,thanks
Thanks for the quick support,thanks
Thank you for the quick support,thanks

Thanks again,thanks
Thank you again,thanks
Thanks once again,thanks
Thank you once again,thanks
Thanks again for your help,thanks
Thank you again for your help,thanks
Thanks again for your support,thanks
Thank you again for your support,thanks
Thanks again for the information,thanks
Thank you again for the information,thanks

"Thanks, that is all I needed",thanks
"Thank you, that is all I needed",thanks
"Thanks, problem solved",thanks
"Thank you, problem solved",thanks
"Thanks, that solves my problem",thanks
"Thank you, that solves my problem",thanks
"Thanks, everything is clear now",thanks
"Thank you, everything is clear now",thanks
"Thanks, I am satisfied",thanks
"Thank you, I am satisfied",thanks

"Thanks, have a great day",thanks
"Thank you, have a great day",thanks
"Thanks, have a nice day",thanks
"Thank you, have a nice day",thanks
"Thanks, take care",thanks
"Thank you, take care",thanks
"Thanks, see you",thanks
"Thank you, see you",thanks
"Thanks, bye",thanks
"Thank you, bye",thanks

Thanks for the help today,thanks
Thank you for your assistance today,thanks
I appreciate your help today,thanks
Thanks for clearing that up,thanks
Thank you for clearing that up,thanks
Thanks for solving my problem,thanks
Thank you for solving my problem,thanks
Thanks for your support today,thanks
Thank you for your support today,thanks
I really appreciate your assistance,thanks

Goodbye,goodbye
Bye,goodbye
See you,goodbye
Bye bye,goodbye
See you later,goodbye
Talk to you later,goodbye
Catch you later,goodbye
See you next time,goodbye
I will chat again later,goodbye
See you soon,goodbye

Bye for now,goodbye
Goodbye for now,goodbye
See you later on,goodbye
Talk soon,goodbye
See you around,goodbye
Catch you soon,goodbye
See you next time again,goodbye
"Bye, see you later",goodbye
"Goodbye, see you later",goodbye
"See you later, goodbye",goodbye

I have to go now,goodbye
I need to leave now,goodbye
I am leaving now,goodbye
I am done for now,goodbye
I will go now,goodbye
I am signing off,goodbye
I will log out now,goodbye
I am ending the chat,goodbye
I will stop here,goodbye
I am done chatting,goodbye

"Thanks, goodbye",goodbye
"Thank you, goodbye",goodbye
"Thanks, bye",goodbye
"Thank you, bye",goodbye
"Thanks, see you",goodbye
"Thank you, see you later",goodbye
"Thanks, talk to you later",goodbye
"Thank you, catch you later",goodbye
"Thanks, see you next time",goodbye
"Thank you, goodbye for now",goodbye

"Bye, have a nice day",goodbye
"Goodbye, have a nice day",goodbye
"See you, have a great day",goodbye
"Bye, take care",goodbye
"Goodbye, take care",goodbye
"See you later, take care",goodbye
"Bye, have a good day",goodbye
"Goodbye, have a good day",goodbye
"See you soon, take care",goodbye
"Bye, stay safe",goodbye

Good night,goodbye
Have a good night,goodbye
See you tomorrow,goodbye
Talk to you tomorrow,goodbye
See you later tonight,goodbye
Bye for tonight,goodbye
Goodbye for tonight,goodbye
Have a nice evening,goodbye
"Good evening, goodbye",goodbye
See you in the morning,goodbye

Bye chatbot,goodbye
Goodbye chatbot,goodbye
Bye bot,goodbye
Goodbye bot,goodbye
See you chatbot,goodbye
Talk to you later chatbot,goodbye
Catch you later bot,goodbye
See you next time chatbot,goodbye
Bye assistant,goodbye
Goodbye assistant,goodbye

I will come back later,goodbye
I will chat again later,goodbye
I will return soon,goodbye
I will talk again later,goodbye
I will be back later,goodbye
I will reconnect later,goodbye
I will visit again later,goodbye
I will come back soon,goodbye
I will talk to you again,goodbye
I will message later,goodbye

"Bye, that is all for now",goodbye
"Goodbye, that is all for now",goodbye
"See you, that is enough for now",goodbye
"I am done, goodbye",goodbye
"That is it, bye",goodbye
"That is all, goodbye",goodbye
"I am finished, goodbye",goodbye
"I am done here, goodbye",goodbye
"That is all I needed, goodbye",goodbye
"Everything is clear now, goodbye",goodbye

"Bye, talk soon",goodbye
"Goodbye, talk soon",goodbye
"See you, talk soon",goodbye
"Bye, see you soon",goodbye
"Goodbye, see you soon",goodbye
"See you later, talk soon",goodbye
"Catch you later, talk soon",goodbye
"Bye, chat soon",goodbye
"Goodbye, chat soon",goodbye
"See you next time, talk soon",goodbye

Bye for today,goodbye
Goodbye for today,goodbye
See you later today,goodbye
Talk to you later today,goodbye
Catch you later today,goodbye
See you again today,goodbye
Bye until later,goodbye
Goodbye until later,goodbye
"See you later today, goodbye",goodbye
Talk again later today,goodbye

"Bye, thanks again",goodbye
"Goodbye, thanks again",goodbye
"See you, thanks",goodbye
"Thanks, bye for now",goodbye
"Thanks, goodbye",goodbye
"Thanks, see you later",goodbye
"Thanks, talk to you later",goodbye
"Thanks, catch you later",goodbye
"Thanks, see you soon",goodbye
"Thanks, bye",goodbye

"Alright, bye",goodbye
"Okay, goodbye",goodbye
"Alright, see you later",goodbye
"Okay, talk to you later",goodbye
"Alright, catch you later",goodbye
"Okay, see you next time",goodbye
"Alright, I am leaving now",goodbye
"Okay, I will go now",goodbye
"Alright, I am done, goodbye",goodbye
"Okay, ending chat, goodbye",goodbye

"Bye, have a great evening",goodbye
"Goodbye, have a great evening",goodbye
"See you, have a nice evening",goodbye
"Bye, enjoy your day",goodbye
"Goodbye, enjoy your day",goodbye
"See you later, enjoy your day",goodbye
"Bye, take care of yourself",goodbye
"Goodbye, stay safe",goodbye
"See you, stay safe",goodbye
"Bye, all the best",goodbye

Farewell,goodbye
"Farewell, see you later",goodbye
"Farewell, take care",goodbye
"Farewell, talk soon",goodbye
"Farewell, until next time",goodbye
"Farewell, goodbye for now",goodbye
"Farewell, have a nice day",goodbye
"Farewell, have a great day",goodbye
"Farewell, see you soon",goodbye
"Farewell, catch you later",goodbye

"Thank you, bye",goodbye
"Thanks, goodbye",goodbye
"Thank you, see you later",goodbye
"Thanks, talk to you later",goodbye
"Thank you, catch you later",goodbye
"Thanks, see you soon",goodbye
"Thank you, bye for now",goodbye
"Thanks, see you next time",goodbye
"Thank you, talk soon",goodbye
"Thanks, I will go now",goodbye