text,intent
Can I contact from overseas?,contact
"Thanks, that was helpful",thanks
"Goodbye, have a nice day",goodbye
Can I use foreign currency to pay?,fees
Thank you for making it clear,thanks
I want to know about courses,courses
"Hi, everything good?",greeting
"Thanks, see you",goodbye
How do I contact finance office?,contact
Can I submit my application online?,admission
Make me smile,unknown
What are the course categories?,courses
How do I find my timetable for this semester?,timetable
Can I message the university?,contact
"Hello, what's going on?",greeting
How do I know my next lecture?,timetable
What subjects are included in courses?,courses
Good to see you,greeting
What courses can I take?,courses
"Bye, enjoy your day",goodbye
How do I update Windows?,unknown
What is required for application?,admission
"Hello chatbot, how are you?",greeting
What is my lecture timetable?,timetable
What movies do you like?,unknown
What do I need for enrollment?,admission
What academic programmes are available?,courses
How do I check schedule updates?,timetable
Can I switch courses after enrolling?,courses
How can I become a student here?,admission
Thank you for solving my problem,thanks
Thanks for making it clear,thanks
What is my class schedule?,timetable
Can I buy groceries here?,unknown
Hello there,greeting
Where do I find subject schedules?,timetable
